{
  "project_name": "Korgantas Rare Earths Feasibility",
  "commodity": "rare_earth_elements",
  "origin_jurisdiction": "Kazakhstan",
  "decision_question": "Should we proceed to binding offtake agreement for neodymium-praseodymium concentrates?",
  "decision_stage": "pre_offtake_agreement",
  "supplied_sources": []
}
