{
  "project_name": "Central Asia Lithium Brine Offtake",
  "commodity": "lithium",
  "origin_jurisdiction": "Kazakhstan",
  "processing_jurisdiction": "China",
  "target_market": "eu",
  "decision_question": "Can we execute the 5-year spodumene concentrate offtake agreement?",
  "decision_stage": "pre_offtake_agreement",
  "supplied_sources": [
    {
      "source_type": "mining_concession_or_license_extract",
      "title": "Subsoil Use Contract #4812",
      "date": "2025-11-10",
      "issuing_authority": "Ministry of Industry and Construction RK"
    },
    {
      "source_type": "certified_ore_assay_report",
      "title": "ALS Minerals JORC Assay Report",
      "date": "2026-01-15",
      "issuing_authority": "ALS Minerals Kazakhstan"
    },
    {
      "source_type": "chain_of_custody_records",
      "title": "Synthetic test delivery record",
      "issuing_authority": "Fictional test supplier",
      "date": "2026-10-18",
      "excerpt": "SYNTHETIC TEST. Added excerpt is not an actual record.",
      "scope": {
        "project_name": "Central Asia Lithium Brine Offtake",
        "commodity": "lithium",
        "origin_jurisdiction": "Kazakhstan"
      }
    }
  ],
  "previous_submission": {
    "project_name": "Central Asia Lithium Brine Offtake",
    "commodity": "lithium",
    "origin_jurisdiction": "Kazakhstan",
    "processing_jurisdiction": "China",
    "target_market": "eu",
    "decision_question": "Can we execute the 5-year spodumene concentrate offtake agreement?",
    "decision_stage": "pre_offtake_agreement",
    "supplied_sources": [
      {
        "source_type": "mining_concession_or_license_extract",
        "title": "Subsoil Use Contract #4812",
        "date": "2025-11-10",
        "issuing_authority": "Ministry of Industry and Construction RK"
      },
      {
        "source_type": "certified_ore_assay_report",
        "title": "ALS Minerals JORC Assay Report",
        "date": "2026-01-15",
        "issuing_authority": "ALS Minerals Kazakhstan"
      }
    ],
    "assessment_date": "2026-10-18"
  },
  "assessment_date": "2026-10-19"
}
